{
  "serverHostname": "localhost",
  "serverPort": 4200,
  "gameName": "the project game",
  "gameDescription": "High sham chance, many pieces",
  "gamesLimit": 5,
  "teamSizes": {
    "1": 5,
    "2": 5
  },
  "pointsLimit": 20,
  "boardSize": {
    "x": 30,
    "taskArea": 30,
    "goalArea": 10
  },
  "shamChance": 0.8,
  "generatePiecesInterval": 3000,
  "piecesLimit": 15,
  "resultFileName": "result.json",
  "actionDelays": {
    "move": 4000,
    "pick": 1000,
    "discover": 2500,
    "destroy": 1000,
    "test": 3000,
    "communicationRequest": 4000,
    "communicationAccept": 4000,
    "tryPiece": 4000
  },
  "timeout": 10000,
  "registrationTriesLimit": 5,
  "registerGameInterval": 10000
}
